{
  "schemaVersion": 1,
  "id": "cn",
  "name": "Computer Networks",
  "shortName": "CN",
  "description": "Explore network layers, protocols, addressing, and routing.",
  "icon": "binary",
  "color": "teal",
  "order": 7,
  "status": "planned",
  "sourceFolder": "CN",
  "lectureCount": 46,
  "storageKey": "cn-quest-v1"
}
